{
  "reviewer": "glm-5.2",
  "summary": "pass 3",
  "overall": "approve",
  "findings": [
    {"id": "G-001", "severity": "high", "category": "correctness", "location": "src/a.py:10",
     "issue": "shared A again", "evidence": "line 11", "failure_case": "x", "suggestion": "fix a",
     "confidence": "high", "recommendation": "must_fix"}
  ]
}
