{
  "reviewer": "glm-5.2",
  "summary": "pass 1",
  "overall": "request_changes",
  "findings": [
    {"id": "G-001", "severity": "high", "category": "correctness", "location": "src/a.py:10",
     "issue": "shared A", "evidence": "line 10", "failure_case": "x", "suggestion": "fix a",
     "confidence": "high", "recommendation": "must_fix"},
    {"id": "G-002", "severity": "medium", "category": "design", "location": "src/b.py:20",
     "issue": "shared B", "evidence": "short", "suggestion": "fix b", "confidence": "medium", "recommendation": "should_fix"},
    {"id": "G-003", "severity": "low", "category": "maintainability", "location": "src/c.py:30",
     "issue": "singleton C", "suggestion": "fix c", "confidence": "low", "recommendation": "nit"}
  ]
}
