{
  "reviewer": "glm-5.2",
  "summary": "Fixture: reviewer #2 side of the planted disagreement. Same location as C-001, opposite call.",
  "overall": "approve_with_nits",
  "findings": [
    {
      "id": "G-001",
      "severity": "medium",
      "category": "correctness",
      "location": "src/queue.py:88 (retry loop)",
      "issue": "Planted disagreement: this reviewer reads the same retry loop as acceptable for now.",
      "evidence": "src/queue.py:88 is guarded by the caller's timeout.",
      "suggestion": "Leave as is; revisit when the caller timeout is removed.",
      "confidence": "medium",
      "recommendation": "defer"
    },
    {
      "id": "G-002",
      "severity": "low",
      "category": "maintainability",
      "location": "src/util.py:12",
      "issue": "Control pair: same call as reviewer #1, must not be flagged.",
      "suggestion": "Rename the variable.",
      "confidence": "high",
      "recommendation": "nit"
    }
  ]
}
