{
  "reviewer": "glm-5.2",
  "summary": "one pass, two distinct findings in the same file",
  "overall": "request_changes",
  "findings": [
    {"id": "G-010", "severity": "high", "category": "correctness", "location": "src/e.py:10",
     "issue": "first issue in e.py", "evidence": "line 10", "failure_case": "x", "suggestion": "fix 10",
     "confidence": "high", "recommendation": "must_fix"},
    {"id": "G-011", "severity": "high", "category": "correctness", "location": "src/e.py:200",
     "issue": "unrelated issue far away in the same file", "evidence": "line 200", "failure_case": "y",
     "suggestion": "fix 200", "confidence": "high", "recommendation": "must_fix"}
  ]
}
